{
  "schemaVersion": 1,
  "runId": "run_AIDEV-216-manual-001",
  "sessionId": "29aa904e-ab22-4f65-a1d6-dc94d49cfd6d",
  "reviewedHead": "022252ffffeaa94b33b50c6b8f801f67343b8e50",
  "status": "remediation_required",
  "summary": "All five attempt-2 findings are independently closed, but final complete-branch review found a blocking first-session allocation race: PiRunner's separate fixed process lease can expire during unresolved setup, allowing two same-run/same-role Pi processes to be live before either exact session is registered.",
  "findings": [
    {
      "id": "R3-001",
      "severity": "critical",
      "blocking": true,
      "summary": "First-session process allocation can launch two live Pi processes after process-lease expiry",
      "details": "PiRunner acquires a fixed 30-second process lease, then performs unbounded runtime resolution, registration lookup/validation, instruction loading, spawn, handshake, and first-session registration without renewing the lease or applying its fencing token to allocation state. In the adversarial probe, launch one blocked in RuntimeResolver; after the injected clock advanced past 30 seconds, launch two acquired the same run/role lease. Releasing runtime resolution produced two distinct live Implement processes simultaneously. One registration eventually won and the other process was killed, but the forbidden double process and second first-session allocation had already occurred.",
      "path": "src/pi/pi-runner.ts",
      "line": 38,
      "recommendation": "Fence the complete run/role allocation protocol. Bound runtime/instruction/handshake operations, renew and verify the process lease before and after every side effect, persist a fenced provisional allocation before first spawn, require the current fencing token for generation claim and registration, and prevent a stale owner from spawning or registering. Add a fake-clock race that stalls each pre-registration step beyond lease expiry and proves only one process/session file can ever be created."
    }
  ],
  "completedAt": "2026-09-01T21:51:39Z"
}
